{"$schema":"https://json-schema.org/draft/2020-12/schema","$id":"https://github.com/Hawkar-usls/AIFC/schemas/bridge-derived-semantic-object-v2.schema.json","title":"AIFC Bridge Derived Semantic Object v2","type":"object","additionalProperties":false,"required":["schema","derived_semantic_object_id","entailment_question_id","atom_id","semantic_identity","semantic_role","source_semantic_reference_ids","derivation_profile_id","derivation_profile_content_hash","derivation_proof_id","derivation_proof_content_hash","canonical_leaf_manifest_id","canonical_leaf_manifest_hash","canonical_dependency_graph_id","canonical_dependency_graph_hash","derivation_authority_status","authority_lineage_ref","derivation_content_hash"],"properties":{"schema":{"const":"AIFC/bridge-derived-semantic-object/v2"},"derived_semantic_object_id":{"type":"string","minLength":1},"entailment_question_id":{"type":"string","pattern":"^[0-9a-f]{64}$"},"atom_id":{"type":"string","minLength":1},"semantic_identity":{"type":"string","minLength":1},"semantic_role":{"const":"BRIDGE_DERIVED_ATOM"},"derivation_profile_id":{"type":"string","minLength":1},"derivation_profile_content_hash":{"type":"string","pattern":"^[0-9a-f]{64}$"},"derivation_proof_id":{"type":"string","minLength":1},"derivation_proof_content_hash":{"type":"string","pattern":"^[0-9a-f]{64}$"},"canonical_leaf_manifest_id":{"type":"string","minLength":1},"canonical_leaf_manifest_hash":{"type":"string","pattern":"^[0-9a-f]{64}$"},"canonical_dependency_graph_id":{"type":"string","minLength":1},"canonical_dependency_graph_hash":{"type":"string","pattern":"^[0-9a-f]{64}$"},"derivation_authority_status":{"enum":["SUCCESSOR_CANDIDATE_NOT_AUTHORITY_ADMISSIBLE","AUTHORITY_ADMISSIBLE"]},"authority_lineage_ref":{"oneOf":[{"type":"null"},{"type":"object"}]},"derivation_content_hash":{"type":"string","pattern":"^[0-9a-f]{64}$"},"source_semantic_reference_ids":{"type":"array","minItems":1,"uniqueItems":true,"items":{"type":"string","minLength":1}}}}
