{"schema":"AIFC/bridge-derived-semantic-object/v2","derived_semantic_object_id":"AIFC-SAL-V1.11-BRIDGE-DERIVED-SEMANTIC-OBJECT-V2","entailment_question_id":"994c979c702b81a0940f28b8039ad36cb48060c426f42eb1f333bf1630e473b6","atom_id":"BRIDGE_DERIVED_ATOM_V111_DEMO","semantic_identity":"DERIVED_SEMANTIC:f78c6dd6d5a77aec20f1964e2d363c8d3b6edeb47f455c88fb4680d00f4cde5f","semantic_role":"BRIDGE_DERIVED_ATOM","derivation_profile_id":"AIFC-SAL-V1.11-SEMANTIC-DERIVATION-PROFILE-V1","derivation_profile_content_hash":"d16c01f080ceeb4d0888c70c3644448572dda0bbe752d1aec2b7780366dae399","derivation_proof_id":"AIFC-SAL-V1.11-SEMANTIC-DERIVATION-PROOF-V1","derivation_proof_content_hash":"cc8d54a3dd8d08c406fa91830152fe13561dfef28289daa92dec36cadea263a0","canonical_leaf_manifest_id":"AIFC-SAL-V1.11-DERIVATION-LEAF-MANIFEST-V1","canonical_leaf_manifest_hash":"38bfaab224e3ec7cc641c28ad43ea1725782cddf5f015ab1c16c1d07ace4d730","canonical_dependency_graph_id":"AIFC-SAL-V1.11-CANONICAL-SEMANTIC-DEPENDENCY-GRAPH-V1","canonical_dependency_graph_hash":"071c8f58e9e0ea4f3d3710c6c89650c1360190ec2605c0e306075ac90b69e933","derivation_authority_status":"SUCCESSOR_CANDIDATE_NOT_AUTHORITY_ADMISSIBLE","authority_lineage_ref":null,"derivation_content_hash":"8073b6acd0d5da9363155bd3a3f2ad18554f5620d489cce6a104c2d1a36e588b","source_semantic_reference_ids":["AIFC-SAL-V1.11-SEMANTIC-REF-A","AIFC-SAL-V1.11-SEMANTIC-REF-B"]}
